{
  "id": "appointments",
  "name": "Appointments",
  "description": "Learn to book, verify, postpone, or cancel appointments in Dutch (een afspraak maken)",
  "level": 14,
  "exercises": [
    {
      "id": "ex_nl_app_1",
      "type": "multipleChoice",
      "question": "How do you say 'To make an appointment' in Dutch?",
      "options": [
        "Een afspraak maken",
        "Een brief schrijven",
        "Een vraag stellen",
        "Een plan bouwen"
      ],
      "correctAnswer": "Een afspraak maken",
      "targetLanguage": "nl-NL",
      "nativeLanguage": "en-US"
    },
    {
      "id": "ex_nl_app_2",
      "type": "translateThis",
      "question": "Ik wil graag mijn afspraak verzetten",
      "options": [],
      "correctAnswer": "I would like to reschedule my appointment",
      "targetLanguage": "nl-NL",
      "nativeLanguage": "en-US"
    },
    {
      "id": "ex_nl_app_3",
      "type": "fillInBlank",
      "question": "Schikt het u om drie ___? (o'clock)",
      "options": [
        "uur",
        "tijd",
        "dag",
        "jaar"
      ],
      "correctAnswer": "uur",
      "targetLanguage": "nl-NL",
      "nativeLanguage": "en-US"
    },
    {
      "id": "ex_nl_app_4",
      "type": "matchPairs",
      "question": "Match appointment actions in Dutch",
      "options": [],
      "correctAnswer": "",
      "targetLanguage": "nl-NL",
      "nativeLanguage": "en-US",
      "metadata": {
        "pairs": [
          {
            "target": "Afzeggen / annuleren",
            "native": "To cancel"
          },
          {
            "target": "Verzetten",
            "native": "To reschedule / postpone"
          },
          {
            "target": "Bevestigen",
            "native": "To confirm"
          },
          {
            "target": "Op tijd",
            "native": "On time / punctual"
          }
        ]
      }
    },
    {
      "id": "ex_nl_app_5",
      "type": "speakThis",
      "question": "Kan ik een afspraak maken met de tandarts?",
      "options": [],
      "correctAnswer": "Kan ik een afspraak maken met de tandarts?",
      "targetLanguage": "nl-NL",
      "nativeLanguage": "en-US"
    },
    {
      "id": "ex_nl_app_6",
      "type": "multipleChoice",
      "question": "What does 'verhinderd zijn' mean when discussing an appointment?",
      "options": [
        "Being unable to attend / prevented from coming",
        "Arriving early",
        "Confirming attendance",
        "Paying in advance"
      ],
      "correctAnswer": "Being unable to attend / prevented from coming",
      "targetLanguage": "nl-NL",
      "nativeLanguage": "en-US"
    }
  ]
}